[
  {
    "schema_id": "block_classifier.v1",
    "config_version": "router_v1.0.0",
    "trace_id": "trace_offline_0001",
    "labels": [
      {
        "name": "conversation",
        "confidence": 1.0
      }
    ],
    "notes": "classifier_v1 split=full code_ratio=0.000"
  },
  {
    "schema_id": "block_classifier.v1",
    "config_version": "router_v1.0.0",
    "trace_id": "trace_offline_0001",
    "labels": [
      {
        "name": "conversation",
        "confidence": 1.0
      }
    ],
    "notes": "classifier_v1 split=full code_ratio=0.000"
  },
  {
    "schema_id": "block_classifier.v1",
    "config_version": "router_v1.0.0",
    "trace_id": "trace_offline_0001",
    "labels": [
      {
        "name": "conversation",
        "confidence": 1.0
      }
    ],
    "notes": "classifier_v1 split=full code_ratio=0.000"
  },
  {
    "schema_id": "block_classifier.v1",
    "config_version": "router_v1.0.0",
    "trace_id": "trace_offline_0001",
    "labels": [
      {
        "name": "conversation",
        "confidence": 1.0
      }
    ],
    "notes": "classifier_v1 split=full code_ratio=0.000"
  },
  {
    "schema_id": "block_classifier.v1",
    "config_version": "router_v1.0.0",
    "trace_id": "trace_offline_0001",
    "labels": [
      {
        "name": "code",
        "confidence": 1.0
      }
    ],
    "notes": "classifier_v1 split=full code_ratio=1.000"
  },
  {
    "schema_id": "block_classifier.v1",
    "config_version": "router_v1.0.0",
    "trace_id": "trace_offline_0001",
    "labels": [
      {
        "name": "conversation",
        "confidence": 1.0
      }
    ],
    "notes": "classifier_v1 split=full code_ratio=0.000"
  }
]